<?xml version="1.0" encoding="UTF-8"?>
<!ELEMENT server (config, auth)>
<!ELEMENT config (port?, serverlist?)>
<!ELEMENT auth (user)*>
<!ELEMENT port EMPTY>
<!ELEMENT serverlist EMPTY>
<!ELEMENT user EMPTY>


<!ATTLIST port
	number	CDATA	#REQUIRED
>

<!ATTLIST serverlist
	url	CDATA	#REQUIRED
>

<!ATTLIST user
	name		CDATA	#REQUIRED
	password	CDATA	#REQUIRED
>